[
  {"id": "pokeball", "name": "Pokéball", "description": "Standard capture device for critters.", "type": "Pokeball", "effect": {"type": "catch-rate", "value": 1}},
  {"id": "great-ball", "name": "Great Ball", "description": "Higher catch rate than Pokéball.", "type": "Pokeball", "effect": {"type": "catch-rate", "value": 1.5}},
  {"id": "ultra-ball", "name": "Ultra Ball", "description": "Much higher catch rate for difficult critters.", "type": "Pokeball", "effect": {"type": "catch-rate", "value": 2}},
  {"id": "master-ball", "name": "Master Ball", "description": "Guaranteed capture. Very rare.", "type": "Pokeball", "effect": {"type": "catch-rate", "value": 100}},
  {"id": "potion", "name": "Potion", "description": "Restores 20 HP to a critter.", "type": "Potion", "effect": {"type": "heal-hp", "value": 20}},
  {"id": "super-potion", "name": "Super Potion", "description": "Restores 50 HP to a critter.", "type": "Potion", "effect": {"type": "heal-hp", "value": 50}},
  {"id": "hyper-potion", "name": "Hyper Potion", "description": "Restores 200 HP to a critter.", "type": "Potion", "effect": {"type": "heal-hp", "value": 200}},
  {"id": "max-potion", "name": "Max Potion", "description": "Fully restores HP to a critter.", "type": "Potion", "effect": {"type": "heal-hp", "value": 999}},
  {"id": "antidote", "name": "Antidote", "description": "Cures poison status.", "type": "Potion", "effect": {"type": "heal-status", "value": 1}},
  {"id": "awakening", "name": "Awakening", "description": "Cures sleep status.", "type": "Potion", "effect": {"type": "heal-status", "value": 2}},
  {"id": "burn-heal", "name": "Burn Heal", "description": "Cures burn status.", "type": "Potion", "effect": {"type": "heal-status", "value": 3}},
  {"id": "ice-heal", "name": "Ice Heal", "description": "Cures freeze status.", "type": "Potion", "effect": {"type": "heal-status", "value": 4}},
  {"id": "paralyze-cure", "name": "Paralyze Cure", "description": "Cures paralysis status.", "type": "Potion", "effect": {"type": "heal-status", "value": 5}},
  {"id": "full-heal", "name": "Full Heal", "description": "Restores HP and cures status problems.", "type": "Potion", "effect": {"type": "heal-hp", "value": 999}},
  {"id": "revive", "name": "Revive", "description": "Revives a fainted critter with 50% HP.", "type": "Potion", "effect": {"type": "revive", "value": 50}},
  {"id": "max-revive", "name": "Max Revive", "description": "Revives a fainted critter with full HP.", "type": "Potion", "effect": {"type": "revive", "value": 100}},
  {"id": "oran-berry", "name": "Oran Berry", "description": "A small berry that restores 10 HP.", "type": "Berry", "effect": {"type": "heal-hp", "value": 10}},
  {"id": "pecha-berry", "name": "Pecha Berry", "description": "A berry that cures poison.", "type": "Berry", "effect": {"type": "heal-status", "value": 1}},
  {"id": "cheri-berry", "name": "Cheri Berry", "description": "A berry that cures paralysis.", "type": "Berry", "effect": {"type": "heal-status", "value": 5}},
  {"id": "sitrus-berry", "name": "Sitrus Berry", "description": "A berry that restores 30 HP.", "type": "Berry", "effect": {"type": "heal-hp", "value": 30}},
  {"id": "tm-flamethrower", "name": "TM01 Flamethrower", "description": "Technical Machine: Teaches Flamethrower.", "type": "TM"},
  {"id": "tm-hydro-pump", "name": "TM02 Hydro Pump", "description": "Technical Machine: Teaches Hydro Pump.", "type": "TM"},
  {"id": "tm-solar-beam", "name": "TM03 Solar Beam", "description": "Technical Machine: Teaches Solar Beam.", "type": "TM"},
  {"id": "tm-thunderbolt", "name": "TM04 Thunderbolt", "description": "Technical Machine: Teaches Thunderbolt.", "type": "TM"},
  {"id": "tm-earthquake", "name": "TM05 Earthquake", "description": "Technical Machine: Teaches Earthquake.", "type": "TM"},
  {"id": "pokedex", "name": "Pokédex", "description": "Automatic device for recording critters.", "type": "Key Item"},
  {"id": "town-map", "name": "Town Map", "description": "Shows all towns and routes in the region.", "type": "Key Item"},
  {"id": "bicycle", "name": "Bicycle", "description": "Travel quickly across routes.", "type": "Key Item"},
  {"id": "badge-1", "name": "Flame Badge", "description": "Badge earned from defeating the Fire-type gym leader.", "type": "Key Item"},
  {"id": "badge-2", "name": "Torrent Badge", "description": "Badge earned from defeating the Water-type gym leader.", "type": "Key Item"}
]
